<?xml version='1.0' encoding='utf-8'?>
<questions xmlns:xsi="http://www.w3.org/2001/XMLSchema-instance" xsi:noNamespaceSchemaLocation="question-xml.xsd">
  <question id="template3-q01" template_id="template3" seed="42">
    <product subject_code="nvr" topic_code="odd_one_out" />
    <question_text>Which grid is the odd one out?</question_text>
    <explanation>The odd one out has a square in the position 3 cell; the others have a triangle there.</explanation>
    <options>
      <option index="0">
        <diagram>
          <array type="rectangular" rows="1" cols="5" draw_mesh="true" draw_full_grid="true">
            <shape key="square" shading="grey_light" />
            <shape key="circle" shading="grey_light" />
            <shape key="triangle" shading="white" />
            <shape key="square" shading="white" />
            <shape key="hexagon" shading="white" />
          </array>
        </diagram>
      </option>
      <option index="1">
        <diagram>
          <array type="rectangular" rows="1" cols="5" draw_mesh="true" draw_full_grid="true">
            <shape key="square" shading="white" />
            <shape key="circle" shading="white" />
            <shape key="square" shading="grey_light" />
            <shape key="triangle" shading="white" />
            <shape key="triangle" shading="grey_light" />
          </array>
        </diagram>
      </option>
      <option index="2">
        <diagram>
          <array type="rectangular" rows="1" cols="5" draw_mesh="true" draw_full_grid="true">
            <shape key="square" shading="grey" />
            <shape key="circle" shading="white" />
            <shape key="triangle" shading="white" />
            <shape key="circle" shading="white" />
            <shape key="triangle" shading="grey_light" />
          </array>
        </diagram>
      </option>
      <option index="3">
        <diagram>
          <array type="rectangular" rows="1" cols="5" draw_mesh="true" draw_full_grid="true">
            <shape key="hexagon" shading="grey_light" />
            <shape key="square" shading="grey_light" />
            <shape key="triangle" shading="grey_light" />
            <shape key="circle" shading="white" />
            <shape key="triangle" shading="grey_light" />
          </array>
        </diagram>
      </option>
      <option index="4">
        <diagram>
          <array type="rectangular" rows="1" cols="5" draw_mesh="true" draw_full_grid="true">
            <shape key="hexagon" shading="grey" />
            <shape key="square" shading="white" />
            <shape key="triangle" shading="white" />
            <shape key="circle" shading="white" />
            <shape key="pentagon" shading="grey_light" />
          </array>
        </diagram>
      </option>
    </options>
    <correct>1</correct>
  </question>
  <question id="template3-q02" template_id="template3" seed="43">
    <product subject_code="nvr" topic_code="odd_one_out" />
    <question_text>Which grid is the odd one out?</question_text>
    <explanation>The odd one out has a square in the top-middle cell; the others have a circle there.</explanation>
    <options>
      <option index="0">
        <diagram>
          <array type="rectangular" rows="2" cols="3" draw_mesh="true" draw_full_grid="false">
            <null />
            <shape key="circle" shading="white" />
            <shape key="circle" shading="grey" />
            <shape key="hexagon" shading="grey" />
            <shape key="hexagon" shading="grey_light" />
            <shape key="circle" shading="grey_light" />
          </array>
        </diagram>
      </option>
      <option index="1">
        <diagram>
          <array type="rectangular" rows="2" cols="3" draw_mesh="true" draw_full_grid="false">
            <null />
            <shape key="circle" shading="grey_light" />
            <shape key="circle" shading="grey" />
            <shape key="circle" shading="grey_light" />
            <shape key="hexagon" shading="white" />
            <shape key="circle" shading="white" />
          </array>
        </diagram>
      </option>
      <option index="2">
        <diagram>
          <array type="rectangular" rows="2" cols="3" draw_mesh="true" draw_full_grid="false">
            <null />
            <shape key="square" shading="grey" />
            <shape key="square" shading="white" />
            <shape key="square" shading="grey" />
            <shape key="hexagon" shading="white" />
            <shape key="hexagon" shading="grey" />
          </array>
        </diagram>
      </option>
      <option index="3">
        <diagram>
          <array type="rectangular" rows="2" cols="3" draw_mesh="true" draw_full_grid="false">
            <null />
            <shape key="circle" shading="grey_light" />
            <shape key="square" shading="white" />
            <shape key="triangle" shading="white" />
            <shape key="hexagon" shading="white" />
            <shape key="square" shading="white" />
          </array>
        </diagram>
      </option>
      <option index="4">
        <diagram>
          <array type="rectangular" rows="2" cols="3" draw_mesh="true" draw_full_grid="false">
            <null />
            <shape key="circle" shading="grey" />
            <shape key="square" shading="grey" />
            <shape key="pentagon" shading="grey" />
            <shape key="hexagon" shading="grey_light" />
            <shape key="triangle" shading="grey" />
          </array>
        </diagram>
      </option>
    </options>
    <correct>2</correct>
  </question>
</questions>