<?xml version="1.0" encoding="UTF-8"?>
<question id="nvr-odd-001" template_id="odd-one-out-motif" seed="42"
          xmlns:xsi="http://www.w3.org/2001/XMLSchema-instance"
          xsi:noNamespaceSchemaLocation="../question-xml.xsd">
  <product subject_code="nvr" topic_code="odd_one_out"/>
  <question_text>Which shape is the odd one out?</question_text>
  <explanation>The others have four motifs; this one has five.</explanation>
  <options>
    <option index="0">
      <diagram>
        <shape key="square" line_type="solid" shading="white">
          <chaotic motif_key="circle" count="4"/>
        </shape>
      </diagram>
    </option>
    <option index="1">
      <diagram>
        <shape key="circle" line_type="dashed" shading="grey_light">
          <chaotic motif_key="circle" count="4"/>
        </shape>
      </diagram>
    </option>
    <option index="2">
      <diagram>
        <shape key="triangle" line_type="solid" shading="white">
          <chaotic motif_key="circle" count="5"/>
        </shape>
      </diagram>
    </option>
    <option index="3">
      <diagram>
        <shape key="hexagon" line_type="solid" shading="white">
          <chaotic motif_key="circle" count="4"/>
        </shape>
      </diagram>
    </option>
    <option index="4">
      <diagram>
        <shape key="pentagon" line_type="dotted" shading="grey_light">
          <chaotic motif_key="circle" count="4"/>
        </shape>
      </diagram>
    </option>
  </options>
  <correct>2</correct>
</question>
